{
  "schemaVersion": "fbsir.super-independent-board.evolution-proposal/v1",
  "productId": "fbsir-super-independent-board",
  "packageVersion": "${manifest.version}",
  "proposalId": "evo_example_001",
  "scope": "current_session",
  "field": "outputDensity",
  "currentValue": "standard",
  "proposedValue": "compact",
  "evidence": [
    "用户连续三次明确要求先给一页结论。"
  ],
  "expectedEffect": "后续首屏先给紧凑结论，详细证据保持可展开。",
  "mustNotChange": [
    "事实",
    "来源",
    "置信度",
    "最强反方",
    "失效条件",
    "人工关卡",
    "用户最终决策权"
  ],
  "status": "awaiting_user_confirmation",
  "rollback": "用户可以随时恢复 standard 或要求忘记本次偏好。"
}
